{
  "id": "01M5TR3G00J9MYEM6PVZ9ZFH25",
  "source_id": "47d1b11c-7eb9-425b-9a95-b3b40f3469dc:0",
  "road_ref": "01M5W9Y9E9N569TJC2T4WA3S5G",
  "road_id": "47d1b11c-7eb9-425b-9a95-b3b40f3469dc:0",
  "road_name": null,
  "road_type": "residential",
  "classification": "needs_review",
  "legal_default_candidate_kmh": 70,
  "speed_limit_kmh": null,
  "verification_status": "unverified",
  "source": "2012-gazette-rule-3-candidate"
}
