{
  "id": "01M5TR3G009B2KYFM9Y75VD90B",
  "source_id": "bc122a22-0968-42f7-9d04-b152759d8a6b:0",
  "road_ref": "01M5W9YR3DEE3Q396ZYGXBGHDR",
  "road_id": "bc122a22-0968-42f7-9d04-b152759d8a6b:0",
  "road_name": null,
  "road_type": "residential",
  "classification": "needs_review",
  "legal_default_candidate_kmh": 70,
  "speed_limit_kmh": null,
  "verification_status": "unverified",
  "source": "2012-gazette-rule-3-candidate"
}
