{
  "id": "01M5TR3G008NV4TXG77XREGQG1",
  "source_id": "bfb056b3-e93e-4535-ab38-f26694accac3:0",
  "road_ref": "01M5W9YRSXR7A4KNNXF4GKYD58",
  "road_id": "bfb056b3-e93e-4535-ab38-f26694accac3:0",
  "road_name": "Amarasingam Road",
  "road_type": "residential",
  "classification": "needs_review",
  "legal_default_candidate_kmh": 70,
  "speed_limit_kmh": null,
  "verification_status": "unverified",
  "source": "2012-gazette-rule-3-candidate"
}
