{
  "id": "01M5TR3G00SWFZWH27JD3T0GJX",
  "source_id": "766a13f0-d92f-414f-a109-c6dc4d332f04:0",
  "road_ref": "01M5W9YDR4SDAF2TZ6XJDSPHWD",
  "road_id": "766a13f0-d92f-414f-a109-c6dc4d332f04:0",
  "road_name": null,
  "road_type": "residential",
  "classification": "needs_review",
  "legal_default_candidate_kmh": 70,
  "speed_limit_kmh": null,
  "verification_status": "unverified",
  "source": "2012-gazette-rule-3-candidate"
}
