{
  "id": "01M5TR3G00RH35PWMP7RN7GXKK",
  "source_id": "223e9f53-078f-4e95-bbd6-bb5970f980e4:0",
  "road_ref": "01M5W9Y7NYP7WDDYXNZ6M85DJJ",
  "road_id": "223e9f53-078f-4e95-bbd6-bb5970f980e4:0",
  "road_name": null,
  "road_type": "tertiary",
  "classification": "needs_review",
  "legal_default_candidate_kmh": 70,
  "speed_limit_kmh": null,
  "verification_status": "unverified",
  "source": "2012-gazette-rule-3-candidate"
}
