{
  "id": "01M5TR3G00F740XKPZ1B9GFJEZ",
  "source_id": "ee64136a-be08-4769-8bc9-50d69f75202b:0",
  "road_ref": "01M5W9Z1MM16KQ3S91VEC5YMPQ",
  "road_id": "ee64136a-be08-4769-8bc9-50d69f75202b:0",
  "road_name": null,
  "road_type": "path",
  "classification": "needs_review",
  "legal_default_candidate_kmh": 70,
  "speed_limit_kmh": null,
  "verification_status": "unverified",
  "source": "2012-gazette-rule-3-candidate"
}
