{
  "id": "01M5TR3G00DSB5E66QSKHS71VN",
  "source_id": "6f69c7dc-1be0-410a-a2f1-3213406f8e62:0",
  "road_ref": "01M5W9YCT6VZSE8GTKADY4SFC5",
  "road_id": "6f69c7dc-1be0-410a-a2f1-3213406f8e62:0",
  "road_name": "Abrar Mosque Road",
  "road_type": "residential",
  "classification": "needs_review",
  "legal_default_candidate_kmh": 70,
  "speed_limit_kmh": null,
  "verification_status": "unverified",
  "source": "2012-gazette-rule-3-candidate"
}
