{
  "id": "01M5TR3G000PAC97BANATCWZS4",
  "source_id": "0ac07690-a783-4166-89c9-e9a78ca7b23d:0",
  "road_ref": "01M5W9Y71TJ6H0M67S9CZVD86K",
  "road_id": "0ac07690-a783-4166-89c9-e9a78ca7b23d:0",
  "road_name": "Velupillai Road",
  "road_type": "service",
  "classification": "needs_review",
  "legal_default_candidate_kmh": 70,
  "speed_limit_kmh": null,
  "verification_status": "unverified",
  "source": "2012-gazette-rule-3-candidate"
}
