{
  "id": "01M5TR3G00ZZZK6748XC9RA0G0",
  "source_id": "41e46f25-bad5-4e42-90d6-1e71e037a27b:0",
  "road_ref": "01M5W9Y8Z4T8V500FNNZNGSJ27",
  "road_id": "41e46f25-bad5-4e42-90d6-1e71e037a27b:0",
  "road_name": "Ibrahim Manzil Road",
  "road_type": "residential",
  "classification": "needs_review",
  "legal_default_candidate_kmh": 70,
  "speed_limit_kmh": null,
  "verification_status": "unverified",
  "source": "2012-gazette-rule-3-candidate"
}
