{
  "id": "01M5TR3G00GP5B3CJ9W24S0246",
  "source_id": "9bbc40b7-5426-4402-99bb-4b5e1dd69c34:0",
  "road_ref": "01M5W9YK454QXJX49REERXDARH",
  "road_id": "9bbc40b7-5426-4402-99bb-4b5e1dd69c34:0",
  "road_name": null,
  "road_type": "residential",
  "classification": "needs_review",
  "legal_default_candidate_kmh": 70,
  "speed_limit_kmh": null,
  "verification_status": "unverified",
  "source": "2012-gazette-rule-3-candidate"
}
