{
  "id": "01M5TR3G00FCDDCZDKK231385T",
  "source_id": "bc3751b0-7ab6-42b5-9872-cd1d3778364e:0",
  "road_ref": "01M5W9YR57H3FB2F2BZJZKNV22",
  "road_id": "bc3751b0-7ab6-42b5-9872-cd1d3778364e:0",
  "road_name": null,
  "road_type": "residential",
  "classification": "needs_review",
  "legal_default_candidate_kmh": 70,
  "speed_limit_kmh": null,
  "verification_status": "unverified",
  "source": "2012-gazette-rule-3-candidate"
}
