{
  "id": "01M5TR3G00FY0V7AF93JWGX8RR",
  "source_id": "3c38ca51-d9bd-4060-82e3-8cb5aa66ea1d:0",
  "road_ref": "01M5W9Y8MMW5APJDNBH9ZDTGWY",
  "road_id": "3c38ca51-d9bd-4060-82e3-8cb5aa66ea1d:0",
  "road_name": null,
  "road_type": "track",
  "classification": "needs_review",
  "legal_default_candidate_kmh": 70,
  "speed_limit_kmh": null,
  "verification_status": "unverified",
  "source": "2012-gazette-rule-3-candidate"
}
