{
  "id": "01M5TR3G00JFE70B95P944DSZ0",
  "source_id": "536a73c3-8a25-4ea7-ae28-f31995fe33dd:0",
  "road_ref": "01M5W9YACCFE98X4XSFTY6Z2MV",
  "road_id": "536a73c3-8a25-4ea7-ae28-f31995fe33dd:0",
  "road_name": null,
  "road_type": "residential",
  "classification": "needs_review",
  "legal_default_candidate_kmh": 70,
  "speed_limit_kmh": null,
  "verification_status": "unverified",
  "source": "2012-gazette-rule-3-candidate"
}
