{
  "id": "01M5TR3G001DNVB4246GTSGBAX",
  "source_id": "838d5423-340f-45e2-bfdb-3166514ac283:0",
  "road_ref": "01M5W9YFPPV6PKXHWW4BPQFRJQ",
  "road_id": "838d5423-340f-45e2-bfdb-3166514ac283:0",
  "road_name": null,
  "road_type": "footway",
  "classification": "needs_review",
  "legal_default_candidate_kmh": 70,
  "speed_limit_kmh": null,
  "verification_status": "unverified",
  "source": "2012-gazette-rule-3-candidate"
}
