{
  "id": "01M5TR3G00BHFY672M4EZZZ1Z0",
  "source_id": "d1f2c420-c3c9-4091-83a6-ab5a31889175:0",
  "road_ref": "01M5W9YW597G6GTVT3T26GSCQQ",
  "road_id": "d1f2c420-c3c9-4091-83a6-ab5a31889175:0",
  "road_name": null,
  "road_type": "residential",
  "classification": "needs_review",
  "legal_default_candidate_kmh": 70,
  "speed_limit_kmh": null,
  "verification_status": "unverified",
  "source": "2012-gazette-rule-3-candidate"
}
