{
  "id": "01M5TR3G00DDSMXTRK0WEHXQCV",
  "source_id": "9424ece6-7b66-4176-9641-300cb8c960eb:0",
  "road_ref": "01M5W9YJ128WBC5N8YTB5QSSW6",
  "road_id": "9424ece6-7b66-4176-9641-300cb8c960eb:0",
  "road_name": null,
  "road_type": "residential",
  "classification": "needs_review",
  "legal_default_candidate_kmh": 70,
  "speed_limit_kmh": null,
  "verification_status": "unverified",
  "source": "2012-gazette-rule-3-candidate"
}
