{
  "id": "01M5TR3G00YCNJXX26F2YH9TNS",
  "source_id": "3b70f36d-dc3e-4929-804e-db582934499b:0",
  "road_ref": "01M5W9Y8JYAEG8DJ6P4BJJ9816",
  "road_id": "3b70f36d-dc3e-4929-804e-db582934499b:0",
  "road_name": null,
  "road_type": "residential",
  "classification": "needs_review",
  "legal_default_candidate_kmh": 70,
  "speed_limit_kmh": null,
  "verification_status": "unverified",
  "source": "2012-gazette-rule-3-candidate"
}
