{
  "id": "01M5TR3G009PHWNVCWYKWMSR7W",
  "source_id": "2d85b002-273c-41c8-9157-ee6ff7b40271:0",
  "road_ref": "01M5W9Y80RBQKHP1F7CPMYXS92",
  "road_id": "2d85b002-273c-41c8-9157-ee6ff7b40271:0",
  "road_name": null,
  "road_type": "service",
  "classification": "needs_review",
  "legal_default_candidate_kmh": 70,
  "speed_limit_kmh": null,
  "verification_status": "unverified",
  "source": "2012-gazette-rule-3-candidate"
}
