{
  "id": "01M5TR3G001QF3EVGF7Q8W3759",
  "source_id": "08dfff26-f4ae-49b0-b735-0e0f5780c106:0",
  "road_ref": "01M5W9Y713K400AH7T9JZKE3AS",
  "road_id": "08dfff26-f4ae-49b0-b735-0e0f5780c106:0",
  "road_name": null,
  "road_type": "residential",
  "classification": "needs_review",
  "legal_default_candidate_kmh": 70,
  "speed_limit_kmh": null,
  "verification_status": "unverified",
  "source": "2012-gazette-rule-3-candidate"
}
