{
  "id": "01M5TR3G0080MHY3MYYQ3DWD4W",
  "source_id": "e0567977-fcb5-4127-8afb-adb3b5782497:0",
  "road_ref": "01M5W9YZ1W0D8Y9PK24C57HP95",
  "road_id": "e0567977-fcb5-4127-8afb-adb3b5782497:0",
  "road_name": null,
  "road_type": "residential",
  "classification": "needs_review",
  "legal_default_candidate_kmh": 70,
  "speed_limit_kmh": null,
  "verification_status": "unverified",
  "source": "2012-gazette-rule-3-candidate"
}
