{
  "id": "01M5TR3G007B7N5E4YD3N60HH7",
  "source_id": "bdb3a498-bc3b-4a6f-801f-b2e2a552acf9:0",
  "road_ref": "01M5W9YRCPDXTB8QBTT3P9YQ99",
  "road_id": "bdb3a498-bc3b-4a6f-801f-b2e2a552acf9:0",
  "road_name": null,
  "road_type": "residential",
  "classification": "needs_review",
  "legal_default_candidate_kmh": 70,
  "speed_limit_kmh": null,
  "verification_status": "unverified",
  "source": "2012-gazette-rule-3-candidate"
}
