{
  "id": "01M5TR3G00JE7J41XA9983B5MR",
  "source_id": "d8837ba3-3a50-4a7f-9a5d-5f938e0fc9dc:0",
  "road_ref": "01M5W9YXGZFXFJVZ03WT89G8KM",
  "road_id": "d8837ba3-3a50-4a7f-9a5d-5f938e0fc9dc:0",
  "road_name": null,
  "road_type": "residential",
  "classification": "needs_review",
  "legal_default_candidate_kmh": 70,
  "speed_limit_kmh": null,
  "verification_status": "unverified",
  "source": "2012-gazette-rule-3-candidate"
}
