{
  "id": "01M5TR3G009YXBFNB33Z3Z8R0P",
  "source_id": "169a3402-4c47-4409-b32d-fac8f570ae3e:0",
  "road_ref": "01M5W9Y78YFY3DYDR1S7PYSVW4",
  "road_id": "169a3402-4c47-4409-b32d-fac8f570ae3e:0",
  "road_name": null,
  "road_type": "residential",
  "classification": "needs_review",
  "legal_default_candidate_kmh": 70,
  "speed_limit_kmh": null,
  "verification_status": "unverified",
  "source": "2012-gazette-rule-3-candidate"
}
