{
  "id": "01M5TR3G007NDA5F3D228100WW",
  "source_id": "1d29f796-537e-4710-aa03-8c68e91d6269:0",
  "road_ref": "01M5W9Y7GJHE5EF0QPZCJ3BK1K",
  "road_id": "1d29f796-537e-4710-aa03-8c68e91d6269:0",
  "road_name": null,
  "road_type": "residential",
  "classification": "needs_review",
  "legal_default_candidate_kmh": 70,
  "speed_limit_kmh": null,
  "verification_status": "unverified",
  "source": "2012-gazette-rule-3-candidate"
}
